{
  "title": "AI短剧出海风起时",
  "subtitle": "从内容爆款到全球增长系统",
  "audience": "出海团队 / 投资人 / 内容创作者",
  "scenario": "行业趋势分享",
  "tone": "Apple Bento + glassmorphism + strategic insight",
  "language": "zh-CN",
  "features": {
    "gesture": "off",
    "presenterMode": true,
    "editable": true,
    "typstHandout": false
  },
  "theme": "apple-bento-glass",
  "assets": {
    "imageGeneration": {
      "mode": "auto",
      "providerHint": "capability-detected",
      "preferRaster": true,
      "assetStrategy": "png-components",
      "providerConfig": {
        "name": "z-image",
        "mode": "command-or-api",
        "model": "user-selected",
        "apiBaseEnv": "Z_IMAGE_API_BASE",
        "apiKeyEnv": "Z_IMAGE_API_KEY",
        "commandTemplate": "z-image generate --prompt-file {promptFile} --output {outputPath}",
        "outputFormat": "png",
        "supportsAlpha": false,
        "supportsImageReference": true,
        "fallbackStrategy": "image-prompts-json"
      },
      "svgPolicy": "SVG is only for diagrams, icons, wireframes, template frames, or fallback when image generation is unavailable."
    },
    "backgroundDecision": {
      "needed": false,
      "reason": "This strategy deck uses semantic glass cards and small local decor assets; dense business slides stay clearer without full-scene backgrounds.",
      "assetPlan": []
    },
    "spotIllustrations": [
      {
        "id": "spot-market-signal",
        "path": "assets/spot/spot-market-signal.png",
        "slides": ["market-signal"],
        "brief": "A small premium illustration of a vertical-drama phone screen with floating payment and region signal chips, no text in image.",
        "style": "Apple Bento glass, soft dimensional lighting, consistent blue-green accent palette",
        "placement": "right rail beside metric cards",
        "size": "card",
        "maxSlideWidth": "28%",
        "semanticUse": "paid-market validation signal",
        "alt": ""
      },
      {
        "id": "spot-ai-localization",
        "path": "assets/spot/spot-ai-localization.png",
        "slides": ["cover"],
        "brief": "A compact AI localization object cluster: subtitle layers, voice waveform, globe tile, and editing cursor, no text in image.",
        "style": "Apple Bento glass, soft dimensional lighting, consistent blue-green accent palette",
        "placement": "lower-right card corner",
        "size": "spot",
        "maxSlideWidth": "24%",
        "semanticUse": "AI production and localization",
        "alt": ""
      }
    ],
    "firstThreeSlideTrial": {
      "required": false,
      "status": "not-needed",
      "slides": [],
      "notes": "Set required=true for cinematic, story, picture-book, product, brand, or other visual-led decks before completing the full deck."
    }
  },
  "decorAssets": [
    {
      "id": "decor-shield",
      "path": "assets/decor-shield.png",
      "source": "AI-generated PNG in any multimodal image-capable environment, or CSS fallback outside those environments",
      "semanticUse": "quality, audit, safety, risk control",
      "fallback": "CSS glass badge with checkmark"
    },
    {
      "id": "decor-bot",
      "path": "assets/decor-bot.png",
      "source": "AI-generated PNG in any multimodal image-capable environment, or CSS fallback outside those environments",
      "semanticUse": "AI assistant, automation, agent",
      "fallback": "CSS rounded bot tile"
    }
  ],
  "sourceSummary": {
    "thesis": "AI短剧出海的机会不在单部爆款，而在建立可复制的全球内容生产和投放系统。",
    "keyArguments": [
      "短剧验证了竖屏连续剧的高频付费模型。",
      "AI显著降低跨语言本土化和素材测试成本。",
      "竞争会从单点内容转向内容、流量、付费、数据的操作系统。"
    ]
  },
  "slides": [
    {
      "role": "cover",
      "title": "AI短剧出海风起时",
      "layout": "cover-bento-glass",
      "theme": "apple-bento-glass",
      "animations": ["fade-up"],
      "canvasFx": "particles",
      "decorAssets": ["decor-bot"],
      "editable": { "text": true, "layout": true, "notes": true },
      "visibleContent": {
        "kicker": "GLOBAL MICRO-DRAMA × AI PRODUCTION",
        "lead": "当爽感叙事遇上本土化算法，短剧不再只是内容生意，而是一套可复制的全球增长系统。"
      },
      "speakerNotes": "开场先把判断抛出来：AI短剧出海不是简单把国内短剧翻译出去，而是把剧本、拍摄、配音、投放和付费转化做成一套全球化流水线。"
    },
    {
      "role": "market-signal",
      "title": "海外短剧已经跑出付费样本",
      "layout": "market-signal",
      "theme": "apple-bento-glass",
      "animations": ["stagger"],
      "canvasFx": null,
      "decorAssets": ["decor-shield"],
      "editable": { "text": true, "layout": true, "notes": true },
      "visibleContent": {
        "metrics": [
          { "label": "2025 Q1", "value": "$700M+", "note": "主流短剧 App 海外内购收入量级" },
          { "label": "头部应用", "value": "ReelShort", "note": "验证欧美爽剧 + IAP 解锁路径" },
          { "label": "增长区域", "value": "US / SEA / LATAM", "note": "英语市场先爆发，多语种市场接棒" }
        ],
        "insight": "海外用户已经接受竖屏连续剧 + 分集付费的消费方式。"
      },
      "speakerNotes": "这里的数据不用讲得特别细，重点是付费样本已经成立。"
    }
  ]
}
